{"bounds":[0,0,573.62,961.25],"edges":[{"count":1,"id":"back-office->online-shop","label":{"h":32.75,"lines":[{"size":12,"text":"Calls","tier":0},{"size":11,"text":"[JSON/HTTPS]","tier":1}],"w":86.48,"x":63.52,"y":413.75},"points":[[152,393.75],[152,466.5]],"rels":["back-office/admin-ui->online-shop/api-gateway"],"source":"back-office","style":{"arrow":"end","stroke":"#555555","width":2},"target":"online-shop"},{"count":1,"id":"customer->online-shop","label":{"h":32.75,"lines":[{"size":12,"text":"Browses and buys with","tier":0},{"size":11,"text":"[HTTPS]","tier":1}],"w":139.62,"x":422,"y":172},"points":[[417,132],[417,214.75],[282,214.75],[282,456.5],[232,456.5],[232,466.5]],"rels":["customer->online-shop/web-app"],"source":"customer","style":{"arrow":"end","stroke":"#555555","width":2},"target":"online-shop"},{"count":1,"id":"online-shop->email-service","label":{"h":32.75,"lines":[{"size":12,"text":"Notifies","tier":0},{"size":11,"text":"[AMQP]","tier":1}],"w":51.75,"x":96.25,"y":679.5},"points":[[152,586.5],[152,781.25]],"rels":["online-shop/event-bus->email-service"],"source":"online-shop","style":{"arrow":"end","stroke":"#555555","width":2},"target":"email-service"},{"count":1,"id":"online-shop->payment-provider","label":{"h":32.75,"lines":[{"size":12,"text":"Charges cards with","tier":0},{"size":11,"text":"[HTTPS]","tier":1}],"w":118.1,"x":237,"y":679.5},"points":[[232,586.5],[232,722.25],[412,722.25],[412,781.25]],"rels":["online-shop/order-service/payment-client->payment-provider"],"source":"online-shop","style":{"arrow":"end","stroke":"#555555","width":2},"target":"payment-provider"},{"count":1,"id":"support-agent->back-office","label":{"h":32.75,"lines":[{"size":12,"text":"Helps customers with","tier":0},{"size":11,"text":"[HTTPS]","tier":1}],"w":130.77,"x":17.23,"y":172},"points":[[152,132],[152,273.75]],"rels":["support-agent->back-office/admin-ui"],"source":"support-agent","style":{"arrow":"end","stroke":"#555555","width":2},"target":"back-office"}],"key":"v/landscape","layout":{"engine":"elkjs","inputHash":"sha256:bc26b1bbee114d9760ec6885dba3759fe1db45f5a8d441fdcd3e588c677e3389","options":{"elk.algorithm":"layered","elk.direction":"DOWN","elk.edgeRouting":"ORTHOGONAL","elk.hierarchyHandling":"INCLUDE_CHILDREN","elk.layered.considerModelOrder.strategy":"NONE","elk.layered.spacing.edgeEdgeBetweenLayers":"10","elk.layered.spacing.edgeNodeBetweenLayers":"10","elk.layered.spacing.nodeNodeBetweenLayers":"40","elk.padding":"[top=12,left=12,bottom=12,right=12]","elk.spacing.edgeEdge":"10","elk.spacing.edgeLabel":"4","elk.spacing.edgeNode":"10","elk.spacing.nodeNode":"25"},"passes":1,"version":"0.12.0"},"level":{"kind":"view","scope":"landscape"},"modelHash":"sha256:38854a9350212aa1f05a3a91e7d4dd19a19c8f559f2413fedaf4081dddc0805b","nodes":[{"h":120,"id":"customer","label":{"anchor":"center","lines":[{"text":"Customer","tier":0,"weight":"bold"},{"size":12,"text":"[Person]","tier":1},{"size":12,"text":"Browses the catalogue and buys","tier":2},{"size":12,"text":"things.","tier":2}]},"modelId":"1","name":"Customer","parent":null,"role":"element","shape":"Person","style":{"color":"#ffffff","fill":"#08427b","fontSize":16,"stroke":"#052e56"},"tags":["Element","Person"],"type":"Person","w":240,"x":297,"y":12},{"h":192,"id":"group:external","label":{"anchor":"bottom-left","lines":[{"text":"External","tier":0,"weight":"bold"}]},"name":"External","parent":null,"role":"boundary","shape":"Box","style":{"color":"#000000","dash":[6,4],"fill":"#ffffff","fontSize":16,"stroke":"#888888"},"tags":["Element","Group","Group:External"],"type":"Group","w":540,"x":12,"y":757.25},{"h":120,"id":"email-service","label":{"anchor":"center","lines":[{"text":"Email Service","tier":0,"weight":"bold"},{"size":12,"text":"[Software System]","tier":1},{"size":12,"text":"Sends receipts and notices.","tier":2}]},"modelId":"18","name":"Email Service","parent":"group:external","role":"element","shape":"Box","style":{"color":"#ffffff","fill":"#8a8a8a","fontSize":16,"stroke":"#606060"},"tags":["Element","Software System","External"],"type":"SoftwareSystem","w":240,"x":32,"y":781.25},{"h":120,"id":"payment-provider","label":{"anchor":"center","lines":[{"text":"Payment Provider","tier":0,"weight":"bold"},{"size":12,"text":"[Software System]","tier":1},{"size":12,"text":"Takes card payments.","tier":2}]},"modelId":"17","name":"Payment Provider","parent":"group:external","role":"element","shape":"Box","style":{"color":"#ffffff","fill":"#8a8a8a","fontSize":16,"stroke":"#606060"},"tags":["Element","Software System","External"],"type":"SoftwareSystem","w":240,"x":292,"y":781.25},{"h":384.75,"id":"group:shop","label":{"anchor":"bottom-left","lines":[{"text":"Shop","tier":0,"weight":"bold"}]},"name":"Shop","parent":null,"role":"boundary","shape":"Box","style":{"color":"#000000","dash":[6,4],"fill":"#ffffff","fontSize":16,"stroke":"#888888"},"tags":["Element","Group","Group:Shop"],"type":"Group","w":320,"x":12,"y":249.75},{"h":120,"id":"back-office","label":{"anchor":"center","lines":[{"text":"Back Office","tier":0,"weight":"bold"},{"size":12,"text":"[Software System]","tier":1},{"size":12,"text":"Staff tools for support and refunds.","tier":2}]},"modelId":"15","name":"Back Office","parent":"group:shop","role":"element","shape":"Box","style":{"color":"#ffffff","fill":"#1168bd","fontSize":16,"stroke":"#0b4884"},"tags":["Element","Software System"],"type":"SoftwareSystem","w":240,"x":32,"y":273.75},{"h":120,"id":"online-shop","label":{"anchor":"center","lines":[{"text":"Online Shop","tier":0,"weight":"bold"},{"size":12,"text":"[Software System]","tier":1},{"size":12,"text":"Sells goods to customers over the","tier":2},{"size":12,"text":"web.","tier":2}]},"modelId":"3","name":"Online Shop","parent":"group:shop","role":"element","shape":"Box","style":{"color":"#ffffff","fill":"#1168bd","fontSize":16,"stroke":"#0b4884"},"tags":["Element","Software System"],"type":"SoftwareSystem","w":240,"x":72,"y":466.5},{"h":120,"id":"support-agent","label":{"anchor":"center","lines":[{"text":"Support Agent","tier":0,"weight":"bold"},{"size":12,"text":"[Person]","tier":1},{"size":12,"text":"Helps customers and refunds","tier":2},{"size":12,"text":"orders.","tier":2}]},"modelId":"2","name":"Support Agent","parent":null,"role":"element","shape":"Person","style":{"color":"#ffffff","fill":"#08427b","fontSize":16,"stroke":"#052e56"},"tags":["Element","Person"],"type":"Person","w":240,"x":32,"y":12}],"ports":[],"schema":"buildzr.scene/2","title":"System landscape"}
