{"bounds":[0,0,840,1260],"edges":[{"count":1,"id":"billing->crm","points":[[425,680],[425,820]],"rels":["billing/api/invoicer->crm"],"source":"billing","style":{"arrow":"end","stroke":"#707070","width":1.5},"target":"crm"},{"count":1,"id":"billing->email","points":[[300,470],[260,470]],"rels":["billing/api/invoicer->email"],"source":"billing","style":{"arrow":"end","stroke":"#707070","width":1.5},"target":"email"},{"count":1,"id":"crm->billing","points":[[545,890],[800,890],[800,385],[720,385]],"rels":["crm->billing/api"],"source":"crm","style":{"arrow":"end","stroke":"#707070","width":1.5},"target":"billing"},{"count":2,"id":"customer->billing","points":[[510,200],[510,260]],"rels":["customer->billing/web:pays","customer->billing/web:uses"],"source":"customer","style":{"arrow":"end","stroke":"#707070","width":1.5},"target":"billing"},{"count":1,"id":"support-agent->crm","points":[[425,1080],[425,960]],"rels":["support-agent->crm"],"source":"support-agent","style":{"arrow":"end","stroke":"#707070","width":1.5},"target":"crm"}],"key":"v/landscape","layout":{"engine":"hand","inputHash":"sha256:unknown","passes":1,"version":"1"},"level":{"kind":"view","scope":"landscape"},"modelHash":"sha256:06be66564654b8ff9d1a808a6dec5331d1553974daad9d56c9e018c5b454d7dc","nodes":[{"h":420,"id":"billing","label":{"anchor":"center","lines":[{"text":"Billing","tier":0,"weight":"bold"},{"size":12,"text":"[Software System]","tier":1}]},"modelId":"3","name":"Billing","parent":null,"role":"element","shape":"Box","style":{"color":"#ffffff","fill":"#1168bd","fontSize":16,"stroke":"#0b4884"},"tags":["Element","Software System"],"type":"SoftwareSystem","w":420,"x":300,"y":260},{"h":140,"id":"crm","label":{"anchor":"center","lines":[{"text":"CRM","tier":0,"weight":"bold"},{"size":12,"text":"[Software System]","tier":1}]},"modelId":"10","name":"CRM","parent":null,"role":"element","shape":"Box","style":{"color":"#000000","fill":"#999999","fontSize":16,"stroke":"#6b6b6b"},"tags":["Element","Software System","External"],"type":"SoftwareSystem","w":240,"x":305,"y":820},{"h":140,"id":"customer","label":{"anchor":"center","lines":[{"text":"Customer","tier":0,"weight":"bold"},{"size":12,"text":"[Person]","tier":1}]},"modelId":"1","name":"Customer","parent":null,"role":"element","shape":"Person","style":{"color":"#ffffff","fill":"#08427b","fontSize":16,"stroke":"#052e56"},"tags":["Element","Person"],"type":"Person","w":240,"x":390,"y":60},{"h":140,"id":"email","label":{"anchor":"center","lines":[{"text":"Email","tier":0,"weight":"bold"},{"size":12,"text":"[Software System]","tier":1}]},"modelId":"11","name":"Email","parent":null,"role":"element","shape":"Box","style":{"color":"#000000","fill":"#999999","fontSize":16,"stroke":"#6b6b6b"},"tags":["Element","Software System","External"],"type":"SoftwareSystem","w":240,"x":20,"y":400},{"h":140,"id":"support-agent","label":{"anchor":"center","lines":[{"text":"Support Agent","tier":0,"weight":"bold"},{"size":12,"text":"[Person]","tier":1}]},"modelId":"2","name":"Support Agent","parent":null,"role":"element","shape":"Person","style":{"color":"#ffffff","fill":"#08427b","fontSize":16,"stroke":"#052e56"},"tags":["Element","Person"],"type":"Person","w":240,"x":305,"y":1080}],"ports":[],"schema":"buildzr.scene/2","title":"System landscape"}
