{"bounds":[0,0,530.39,917.98],"edges":[{"count":1,"id":"mes->erp","label":{"h":19,"lines":[{"size":12,"text":"Receives orders from","tier":0}],"w":129.88,"x":226.45,"y":726.98},"points":[[360.33,686.98],[360.33,785.98]],"rels":["mes/collector->erp"],"source":"mes","style":{"arrow":"end","stroke":"#707070","width":1.5},"target":"erp"},{"count":1,"id":"operator->mes","label":{"h":32.75,"lines":[{"size":12,"text":"Watches","tier":0},{"size":11,"text":"[HTTPS]","tier":1}],"w":57.77,"x":403.39,"y":172},"points":[[398.39,132],[398.39,244.75]],"rels":["operator->mes/dashboard"],"source":"operator","style":{"arrow":"end","stroke":"#707070","width":1.5},"target":"mes"},{"count":1,"id":"supervisor->mes","label":{"h":32.75,"lines":[{"size":12,"text":"Reads reports from","tier":0},{"size":11,"text":"[HTTPS]","tier":1}],"w":117.39,"x":12,"y":172},"points":[[133.39,132],[133.39,214.75],[322.27,214.75],[322.27,244.75]],"rels":["supervisor->mes/dashboard"],"source":"supervisor","style":{"arrow":"end","stroke":"#707070","width":1.5},"target":"mes"}],"key":"landscape","layout":{"engine":"elkjs","inputHash":"sha256:5f3df0b88ac22e963447e754f698bba31c692c0ad478415d520d54d90fa67960","options":{"elk.algorithm":"layered","elk.direction":"DOWN","elk.edgeRouting":"ORTHOGONAL","elk.hierarchyHandling":"INCLUDE_CHILDREN","elk.layered.considerModelOrder.strategy":"NONE","elk.layered.spacing.edgeEdgeBetweenLayers":"10","elk.layered.spacing.edgeNodeBetweenLayers":"10","elk.layered.spacing.nodeNodeBetweenLayers":"40","elk.padding":"[top=12,left=12,bottom=12,right=12]","elk.spacing.edgeEdge":"10","elk.spacing.edgeLabel":"4","elk.spacing.edgeNode":"10","elk.spacing.nodeNode":"25"},"passes":2,"version":"0.12.0"},"level":{"kind":"landscape","scope":null},"modelHash":"sha256:8d1715251b439bf7d5b8d1a8b6b8235de99feaaa9f0a43a3d6a50e26b10d7d56","nodes":[{"h":120,"id":"erp","label":{"anchor":"center","lines":[{"text":"ERP","tier":0,"weight":"bold"},{"size":12,"text":"[Software System]","tier":1},{"size":12,"text":"Plans production orders.","tier":2}]},"modelId":"6","name":"ERP","parent":null,"role":"element","shape":"Box","style":{"color":"#ffffff","fill":"#1168bd","fontSize":16,"stroke":"#0b4884"},"tags":["Element","Software System","External"],"type":"SoftwareSystem","w":240,"x":240.33,"y":785.98},{"frame":{"childType":"Container","children":2,"scale":0.951544,"scene":"e/mes"},"h":442.23,"id":"mes","label":{"anchor":"top","lines":[{"text":"MES","tier":0,"weight":"bold"},{"size":12,"text":"[Software System]","tier":1},{"size":12,"text":"Manufacturing execution system.","tier":2}]},"modelId":"3","name":"MES","parent":null,"role":"element","shape":"Box","style":{"color":"#ffffff","fill":"#1168bd","fontSize":16,"stroke":"#0b4884"},"tags":["Element","Software System"],"type":"SoftwareSystem","w":303.91,"x":189.63,"y":244.75},{"h":120,"id":"operator","label":{"anchor":"center","lines":[{"text":"Operator","tier":0,"weight":"bold"},{"size":12,"text":"[Person]","tier":1},{"size":12,"text":"Runs the line.","tier":2}]},"modelId":"1","name":"Operator","parent":null,"role":"element","shape":"Person","style":{"color":"#ffffff","fill":"#08427b","fontSize":16,"stroke":"#052e56"},"tags":["Element","Person"],"type":"Person","w":240,"x":278.39,"y":12},{"h":120,"id":"supervisor","label":{"anchor":"center","lines":[{"text":"Supervisor","tier":0,"weight":"bold"},{"size":12,"text":"[Person]","tier":1},{"size":12,"text":"Reviews the shift report.","tier":2}]},"modelId":"2","name":"Supervisor","parent":null,"role":"element","shape":"Person","style":{"color":"#ffffff","fill":"#08427b","fontSize":16,"stroke":"#052e56"},"tags":["Element","Person"],"type":"Person","w":240,"x":13.39,"y":12}],"ports":[],"schema":"buildzr.scene/2","title":"Factory"}
