{"bounds":[0,0,358.31,619],"edges":[{"count":1,"id":"customer->shop/web-app#1","label":{"h":19,"lines":[{"size":12,"text":"1: Signs in using","tier":0}],"w":98.63,"x":103.68,"y":172},"order":"1","points":[[206.31,132],[206.31,260]],"rels":["customer->shop/web-app"],"source":"customer","style":{"arrow":"end","stroke":"#707070","width":1.5},"target":"shop/web-app"},{"count":1,"id":"shop/web-app->shop/api#2","label":{"h":19,"lines":[{"size":12,"text":"2: Checks the password with","tier":0}],"w":172.31,"x":32,"y":400},"order":"2","points":[[206.31,380],[206.31,439]],"rels":["shop/web-app->shop/api"],"source":"shop/web-app","style":{"arrow":"end","stroke":"#707070","width":1.5},"target":"shop/api"}],"key":"v/sign-in","layout":{"engine":"elkjs","inputHash":"sha256:f3c07d2cdcd4d8701104ca32e23016aa275d7b38c64f4ab72fd81a8ce70a2670","options":{"elk.algorithm":"layered","elk.direction":"DOWN","elk.edgeRouting":"ORTHOGONAL","elk.hierarchyHandling":"INCLUDE_CHILDREN","elk.layered.considerModelOrder.strategy":"NONE","elk.layered.spacing.edgeEdgeBetweenLayers":"10","elk.layered.spacing.edgeNodeBetweenLayers":"10","elk.layered.spacing.nodeNodeBetweenLayers":"40","elk.padding":"[top=12,left=12,bottom=12,right=12]","elk.spacing.edgeEdge":"10","elk.spacing.edgeLabel":"4","elk.spacing.edgeNode":"10","elk.spacing.nodeNode":"25"},"passes":1,"version":"0.12.0"},"level":{"kind":"view","scope":"sign-in"},"modelHash":"sha256:79288b1fe9504a57cb949fb0708d2417ec651fc79440eeb9162b6a466fe28ade","nodes":[{"h":120,"id":"customer","label":{"anchor":"center","lines":[{"text":"Customer","tier":0,"weight":"bold"},{"size":12,"text":"[Person]","tier":1}]},"modelId":"1","name":"Customer","parent":null,"role":"element","shape":"Person","style":{"color":"#ffffff","fill":"#08427b","fontSize":16,"stroke":"#052e56"},"tags":["Element","Person"],"type":"Person","w":240,"x":86.31,"y":12},{"h":371,"id":"shop","label":{"anchor":"bottom-left","lines":[{"text":"Shop","tier":0,"weight":"bold"},{"size":12,"text":"[Software System]","tier":1}]},"modelId":"2","name":"Shop","parent":null,"role":"boundary","shape":"Box","style":{"color":"#1168bd","dash":[6,4],"fill":"#ffffff","fontSize":16,"stroke":"#1168bd"},"tags":["Element","Software System","Internal"],"type":"SoftwareSystem","w":334.31,"x":12,"y":236},{"h":120,"id":"shop/api","label":{"anchor":"center","lines":[{"text":"API","tier":0,"weight":"bold"},{"size":12,"text":"[Container]","tier":1}]},"modelId":"4","name":"API","parent":"shop","role":"element","shape":"Box","style":{"color":"#000000","fill":"#438dd5","fontSize":16,"stroke":"#2e6295"},"tags":["Element","Container"],"type":"Container","w":240,"x":86.31,"y":439},{"h":120,"id":"shop/web-app","label":{"anchor":"center","lines":[{"text":"Web App","tier":0,"weight":"bold"},{"size":12,"text":"[Container]","tier":1}]},"modelId":"3","name":"Web App","parent":"shop","role":"element","shape":"Box","style":{"color":"#000000","fill":"#438dd5","fontSize":16,"stroke":"#2e6295"},"tags":["Element","Container"],"type":"Container","w":240,"x":86.31,"y":260}],"ports":[],"schema":"buildzr.scene/2","title":"Sign in"}
