{"bounds":[0,0,304,216],"edges":[],"key":"v/staging","layout":{"engine":"elkjs","inputHash":"sha256:85460b98a40a9325ce32f9298c8a4680716a56b240708368d20282dcff8aeeae","options":{"elk.algorithm":"layered","elk.direction":"DOWN","elk.edgeRouting":"ORTHOGONAL","elk.hierarchyHandling":"INCLUDE_CHILDREN","elk.layered.considerModelOrder.strategy":"NONE","elk.layered.spacing.edgeEdgeBetweenLayers":"10","elk.layered.spacing.edgeNodeBetweenLayers":"10","elk.layered.spacing.nodeNodeBetweenLayers":"40","elk.padding":"[top=12,left=12,bottom=12,right=12]","elk.spacing.edgeEdge":"10","elk.spacing.edgeLabel":"4","elk.spacing.edgeNode":"10","elk.spacing.nodeNode":"25"},"passes":1,"version":"0.12.0"},"level":{"kind":"view","scope":"staging"},"modelHash":"sha256:7d6760e21444d2c3bc5b95212ab6b16e06ad6b9759ecdb290c99e216f598202a","nodes":[{"h":192,"id":"deploy/staging/staging-server","label":{"anchor":"bottom-left","lines":[{"text":"Staging server","tier":0,"weight":"bold"},{"size":12,"text":"[Deployment Node: Ubuntu]","tier":1}]},"modelId":"25","name":"Staging server","parent":null,"role":"boundary","shape":"Box","style":{"color":"#000000","fill":"#ffffff","fontSize":16,"stroke":"#888888"},"tags":["Element","Deployment Node"],"type":"DeploymentNode","w":280,"x":12,"y":12},{"h":120,"id":"deploy/staging/staging-server/api","label":{"anchor":"center","lines":[{"text":"API","tier":0,"weight":"bold"},{"size":12,"text":"[Container: Python]","tier":1}]},"modelId":"26","name":"API","parent":"deploy/staging/staging-server","role":"element","shape":"Box","style":{"color":"#000000","fill":"#438dd5","fontSize":16,"stroke":"#2e6295"},"tags":["Container Instance"],"type":"ContainerInstance","w":240,"x":32,"y":36}],"ports":[],"schema":"buildzr.scene/2","title":"Shop in staging"}
