{"bounds":[0,0,591,785.5],"edges":[{"count":1,"id":"online-shop/order-service/checkout->online-shop/order-service/order-repository","label":{"h":19,"lines":[{"size":12,"text":"Saves orders with","tier":0}],"w":109.92,"x":48.08,"y":500.75},"points":[[160,470.75],[160,539.75]],"rels":["online-shop/order-service/checkout->online-shop/order-service/order-repository"],"source":"online-shop/order-service/checkout","style":{"arrow":"end","stroke":"#555555","width":2},"target":"online-shop/order-service/order-repository"},{"count":1,"id":"online-shop/order-service/checkout->online-shop/order-service/payment-client","label":{"h":19,"lines":[{"size":12,"text":"Charges through","tier":0}],"w":103.47,"x":314.53,"y":500.75},"points":[[220,470.75],[220,490.75],[420,490.75],[420,539.75]],"rels":["online-shop/order-service/checkout->online-shop/order-service/payment-client"],"source":"online-shop/order-service/checkout","style":{"arrow":"end","stroke":"#555555","width":2},"target":"online-shop/order-service/payment-client"},{"count":1,"id":"online-shop/order-service/checkout->port:online-shop/order-service->online-shop/catalogue-service","label":{"h":32.75,"lines":[{"size":12,"text":"Reads prices from","tier":0},{"size":11,"text":"[gRPC]","tier":1}],"w":111.51,"x":436.49,"y":732.75},"points":[[280,470.75],[280,480.75],[550,480.75],[550,785.5]],"rels":["online-shop/order-service/checkout->online-shop/catalogue-service"],"source":"online-shop/order-service/checkout","style":{"arrow":"end","stroke":"#555555","width":2},"target":{"port":"online-shop/order-service->online-shop/catalogue-service"}},{"count":1,"id":"online-shop/order-service/order-api->online-shop/order-service/checkout","label":{"h":19,"lines":[{"size":12,"text":"Starts","tier":0}],"w":41.14,"x":176.86,"y":311.75},"points":[[220,291.75],[220,350.75]],"rels":["online-shop/order-service/order-api->online-shop/order-service/checkout"],"source":"online-shop/order-service/order-api","style":{"arrow":"end","stroke":"#555555","width":2},"target":"online-shop/order-service/checkout"},{"count":1,"id":"online-shop/order-service/order-repository->port:online-shop/order-service->online-shop/orders-db","label":{"h":32.75,"lines":[{"size":12,"text":"Reads and writes","tier":0},{"size":11,"text":"[SQL]","tier":1}],"w":105.56,"x":52.44,"y":732.75},"points":[[160,659.75],[160,785.5]],"rels":["online-shop/order-service/order-repository->online-shop/orders-db"],"source":"online-shop/order-service/order-repository","style":{"arrow":"end","stroke":"#555555","width":2},"target":{"port":"online-shop/order-service->online-shop/orders-db"}},{"count":1,"id":"online-shop/order-service/payment-client->port:online-shop/order-service->port:online-shop->payment-provider","label":{"h":32.75,"lines":[{"size":12,"text":"Charges cards with","tier":0},{"size":11,"text":"[HTTPS]","tier":1}],"w":118.1,"x":299.9,"y":732.75},"points":[[420,659.75],[420,785.5]],"rels":["online-shop/order-service/payment-client->payment-provider"],"source":"online-shop/order-service/payment-client","style":{"arrow":"end","stroke":"#555555","width":2},"target":{"port":"online-shop/order-service->port:online-shop->payment-provider"}},{"count":1,"id":"port:online-shop/api-gateway->online-shop/order-service->online-shop/order-service/order-api","label":{"h":32.75,"lines":[{"size":12,"text":"Routes orders to","tier":0},{"size":11,"text":"[JSON/HTTPS]","tier":1}],"w":102.05,"x":115.95,"y":90},"points":[[220,0],[220,171.75]],"rels":["online-shop/api-gateway->online-shop/order-service/order-api"],"source":{"port":"online-shop/api-gateway->online-shop/order-service"},"style":{"arrow":"end","stroke":"#555555","width":2},"target":"online-shop/order-service/order-api"}],"key":"e/online-shop/order-service","layout":{"engine":"elkjs","inputHash":"sha256:e0bd706dae3a09dc40813db9dbdc2647291b12344d07efead68640e4eac73c6b","options":{"elk.algorithm":"layered","elk.direction":"DOWN","elk.edgeRouting":"ORTHOGONAL","elk.hierarchyHandling":"INCLUDE_CHILDREN","elk.layered.considerModelOrder.strategy":"NONE","elk.layered.spacing.edgeEdgeBetweenLayers":"10","elk.layered.spacing.edgeNodeBetweenLayers":"10","elk.layered.spacing.nodeNodeBetweenLayers":"40","elk.padding":"[top=0,left=0,bottom=0,right=0]","elk.spacing.edgeEdge":"10","elk.spacing.edgeLabel":"4","elk.spacing.edgeNode":"10","elk.spacing.nodeNode":"25"},"passes":2,"version":"0.12.0"},"level":{"kind":"element","scope":"online-shop/order-service"},"modelHash":"sha256:38854a9350212aa1f05a3a91e7d4dd19a19c8f559f2413fedaf4081dddc0805b","nodes":[{"h":560,"id":"group:shop","label":{"anchor":"bottom-left","lines":[{"text":"Shop","tier":0,"weight":"bold"}]},"name":"Shop","parent":null,"role":"boundary","shape":"Box","style":{"color":"#000000","dash":[6,4],"fill":"#ffffff","fontSize":16,"stroke":"#888888"},"tags":["Element","Group","Group:Shop"],"type":"Group","w":551,"x":20,"y":147.75},{"h":120,"id":"online-shop/order-service/checkout","label":{"anchor":"center","lines":[{"text":"Checkout","tier":0,"weight":"bold"},{"size":12,"text":"[Component: Python]","tier":1},{"size":12,"text":"Prices the basket and starts the","tier":2},{"size":12,"text":"payment.","tier":2}]},"modelId":"8","name":"Checkout","parent":"group:shop","role":"element","shape":"Box","style":{"color":"#000000","fill":"#85bbf0","fontSize":16,"stroke":"#5d82a8"},"tags":["Element","Component"],"type":"Component","w":240,"x":100,"y":350.75},{"h":120,"id":"online-shop/order-service/order-api","label":{"anchor":"center","lines":[{"text":"Order API","tier":0,"weight":"bold"},{"size":12,"text":"[Component: FastAPI]","tier":1},{"size":12,"text":"REST endpoints for orders.","tier":2}]},"modelId":"7","name":"Order API","parent":"group:shop","role":"element","shape":"Box","style":{"color":"#000000","fill":"#85bbf0","fontSize":16,"stroke":"#5d82a8"},"tags":["Element","Component"],"type":"Component","w":240,"x":100,"y":171.75},{"h":120,"id":"online-shop/order-service/order-repository","label":{"anchor":"center","lines":[{"text":"Order Repository","tier":0,"weight":"bold"},{"size":12,"text":"[Component: SQLAlchemy]","tier":1},{"size":12,"text":"Reads and writes orders.","tier":2}]},"modelId":"9","name":"Order Repository","parent":"group:shop","role":"element","shape":"Box","style":{"color":"#000000","fill":"#85bbf0","fontSize":16,"stroke":"#5d82a8"},"tags":["Element","Component"],"type":"Component","w":240,"x":40,"y":539.75},{"h":120,"id":"online-shop/order-service/payment-client","label":{"anchor":"center","lines":[{"text":"Payment Client","tier":0,"weight":"bold"},{"size":12,"text":"[Component: httpx]","tier":1},{"size":12,"text":"Calls the payment provider.","tier":2}]},"modelId":"10","name":"Payment Client","parent":"group:shop","role":"element","shape":"Box","style":{"color":"#000000","fill":"#85bbf0","fontSize":16,"stroke":"#5d82a8"},"tags":["Element","Component"],"type":"Component","w":240,"x":300,"y":539.75}],"ports":[{"id":"online-shop/api-gateway->online-shop/order-service","side":"N","x":220,"y":0},{"id":"online-shop/order-service->online-shop/catalogue-service","side":"S","x":550,"y":785.5},{"id":"online-shop/order-service->online-shop/event-bus","side":"S","x":170,"y":785.5},{"id":"online-shop/order-service->online-shop/orders-db","side":"S","x":160,"y":785.5},{"id":"online-shop/order-service->port:online-shop->payment-provider","side":"S","x":420,"y":785.5}],"schema":"buildzr.scene/2","title":"Order Service"}
