{"bounds":[0,0,840,840],"edges":[{"count":2,"id":"billing/api->billing/db","points":[[420,490],[420,600]],"rels":["billing/api/ledger-repo->billing/db","billing/api/payments->billing/db"],"source":"billing/api","style":{"arrow":"end","stroke":"#707070","width":1.5},"target":"billing/db"},{"count":1,"id":"billing/api->port:billing->crm","points":[[250,490],[250,840]],"rels":["billing/api/invoicer->crm"],"source":"billing/api","style":{"arrow":"end","stroke":"#707070","width":1.5},"target":{"port":"billing->crm"}},{"count":1,"id":"billing/api->port:billing->email","points":[[200,420],[0,420]],"rels":["billing/api/invoicer->email"],"source":"billing/api","style":{"arrow":"end","stroke":"#707070","width":1.5},"target":{"port":"billing->email"}},{"count":2,"id":"billing/web->billing/api","points":[[420,220],[420,320]],"rels":["billing/web->billing/api","billing/web->billing/api/payments"],"source":"billing/web","style":{"arrow":"end","stroke":"#707070","width":1.5},"target":"billing/api"},{"count":1,"id":"port:crm->billing->billing/api","points":[[840,250],[580,250],[580,320]],"rels":["crm->billing/api"],"source":{"port":"crm->billing"},"style":{"arrow":"end","stroke":"#707070","width":1.5},"target":"billing/api"},{"count":2,"id":"port:customer->billing->billing/web","points":[[420,0],[420,80]],"rels":["customer->billing/web:pays","customer->billing/web:uses"],"source":{"port":"customer->billing"},"style":{"arrow":"end","stroke":"#707070","width":1.5},"target":"billing/web"}],"key":"e/billing","layout":{"engine":"hand","inputHash":"sha256:unknown","passes":1,"version":"1"},"level":{"kind":"element","scope":"billing"},"modelHash":"sha256:06be66564654b8ff9d1a808a6dec5331d1553974daad9d56c9e018c5b454d7dc","nodes":[{"frame":{"childType":"Component","children":3,"scale":0.5,"scene":"e/billing/api"},"h":170,"id":"billing/api","label":{"anchor":"top","lines":[{"text":"Billing API","tier":0,"weight":"bold"},{"size":12,"text":"[Container: Go]","tier":1}]},"modelId":"5","name":"Billing API","parent":null,"role":"element","shape":"Box","style":{"color":"#000000","fill":"#438dd5","fontSize":16,"stroke":"#2e6295"},"tags":["Element","Container"],"type":"Container","w":440,"x":200,"y":320},{"h":140,"id":"billing/db","label":{"anchor":"center","lines":[{"text":"Billing DB","tier":0,"weight":"bold"},{"size":12,"text":"[Container: PostgreSQL]","tier":1}]},"modelId":"9","name":"Billing DB","parent":null,"role":"element","shape":"Cylinder","style":{"color":"#000000","fill":"#438dd5","fontSize":16,"stroke":"#2e6295"},"tags":["Element","Container","Database"],"type":"Container","w":240,"x":360,"y":600},{"h":140,"id":"billing/web","label":{"anchor":"center","lines":[{"text":"Web App","tier":0,"weight":"bold"},{"size":12,"text":"[Container: TypeScript, React]","tier":1}]},"modelId":"4","name":"Web App","parent":null,"role":"element","shape":"Box","style":{"color":"#000000","fill":"#438dd5","fontSize":16,"stroke":"#2e6295"},"tags":["Element","Container"],"type":"Container","w":240,"x":300,"y":80}],"ports":[{"id":"billing->crm","side":"S","x":250,"y":840},{"id":"billing->email","side":"W","x":0,"y":420},{"id":"crm->billing","side":"E","x":840,"y":250},{"id":"customer->billing","side":"N","x":420,"y":0}],"schema":"buildzr.scene/2","title":"Billing"}
