{"bounds":[0,0,542.88,870.5],"edges":[{"count":1,"id":"mes/collector->erp","label":{"h":19,"lines":[{"size":12,"text":"Receives orders from","tier":0}],"w":129.88,"x":12,"y":672.62},"points":[[145.88,572.75],[145.88,738.5]],"rels":["mes/collector->erp"],"source":"mes/collector","style":{"arrow":"end","stroke":"#707070","width":1.5},"target":"erp"},{"count":1,"id":"mes/collector->plc","label":{"h":32.75,"lines":[{"size":12,"text":"Polls","tier":0},{"size":11,"text":"[OPC UA]","tier":1}],"w":58.36,"x":415.88,"y":665.75},"points":[[225.88,572.75],[225.88,635.75],[410.88,635.75],[410.88,738.5]],"rels":["mes/collector->plc"],"source":"mes/collector","style":{"arrow":"end","stroke":"#707070","width":1.5},"target":"plc"},{"count":1,"id":"mes/dashboard->mes/collector","label":{"h":19,"lines":[{"size":12,"text":"Reads from","tier":0}],"w":73.18,"x":110.7,"y":413.75},"points":[[185.88,393.75],[185.88,452.75]],"rels":["mes/dashboard->mes/collector"],"source":"mes/dashboard","style":{"arrow":"end","stroke":"#707070","width":1.5},"target":"mes/collector"},{"count":1,"id":"operator->mes/dashboard","label":{"h":32.75,"lines":[{"size":12,"text":"Watches","tier":0},{"size":11,"text":"[HTTPS]","tier":1}],"w":57.77,"x":415.88,"y":172},"points":[[410.88,132],[410.88,214.75],[225.88,214.75],[225.88,273.75]],"rels":["operator->mes/dashboard"],"source":"operator","style":{"arrow":"end","stroke":"#707070","width":1.5},"target":"mes/dashboard"},{"count":1,"id":"supervisor->mes/dashboard","label":{"h":32.75,"lines":[{"size":12,"text":"Reads reports from","tier":0},{"size":11,"text":"[HTTPS]","tier":1}],"w":117.39,"x":24.49,"y":172},"points":[[145.88,132],[145.88,273.75]],"rels":["supervisor->mes/dashboard"],"source":"supervisor","style":{"arrow":"end","stroke":"#707070","width":1.5},"target":"mes/dashboard"}],"key":"v/mes-containers","layout":{"engine":"elkjs","inputHash":"sha256:1258e6155817de0b242ea92ec39c25f1322ed22519076d42994401183d766b13","options":{"elk.algorithm":"layered","elk.direction":"DOWN","elk.edgeRouting":"ORTHOGONAL","elk.hierarchyHandling":"INCLUDE_CHILDREN","elk.layered.considerModelOrder.strategy":"NONE","elk.layered.spacing.edgeEdgeBetweenLayers":"10","elk.layered.spacing.edgeNodeBetweenLayers":"10","elk.layered.spacing.nodeNodeBetweenLayers":"40","elk.padding":"[top=12,left=12,bottom=12,right=12]","elk.spacing.edgeEdge":"10","elk.spacing.edgeLabel":"4","elk.spacing.edgeNode":"10","elk.spacing.nodeNode":"25"},"passes":1,"version":"0.12.0"},"level":{"kind":"view","scope":"mes-containers"},"modelHash":"sha256:8d1715251b439bf7d5b8d1a8b6b8235de99feaaa9f0a43a3d6a50e26b10d7d56","nodes":[{"h":120,"id":"erp","label":{"anchor":"center","lines":[{"text":"ERP","tier":0,"weight":"bold"},{"size":12,"text":"[Software System]","tier":1},{"size":12,"text":"Plans production orders.","tier":2}]},"modelId":"6","name":"ERP","parent":null,"role":"element","shape":"Box","style":{"color":"#ffffff","fill":"#1168bd","fontSize":16,"stroke":"#0b4884"},"tags":["Element","Software System","External"],"type":"SoftwareSystem","w":240,"x":25.88,"y":738.5},{"h":371,"id":"mes","label":{"anchor":"bottom-left","lines":[{"text":"MES","tier":0,"weight":"bold"},{"size":12,"text":"[Software System]","tier":1}]},"modelId":"3","name":"MES","parent":null,"role":"boundary","shape":"Box","style":{"color":"#1168bd","dash":[6,4],"fill":"#ffffff","fontSize":16,"stroke":"#1168bd"},"tags":["Element","Software System"],"type":"SoftwareSystem","w":280,"x":45.88,"y":249.75},{"h":120,"id":"mes/collector","label":{"anchor":"center","lines":[{"text":"Collector","tier":0,"weight":"bold"},{"size":12,"text":"[Container: Python]","tier":1}]},"modelId":"5","name":"Collector","parent":"mes","role":"element","shape":"Box","style":{"color":"#000000","fill":"#438dd5","fontSize":16,"stroke":"#2e6295"},"tags":["Element","Container"],"type":"Container","w":240,"x":65.88,"y":452.75},{"h":120,"id":"mes/dashboard","label":{"anchor":"center","lines":[{"text":"Dashboard","tier":0,"weight":"bold"},{"size":12,"text":"[Container: TypeScript]","tier":1}]},"modelId":"4","name":"Dashboard","parent":"mes","role":"element","shape":"Box","style":{"color":"#000000","fill":"#438dd5","fontSize":16,"stroke":"#2e6295"},"tags":["Element","Container"],"type":"Container","w":240,"x":65.88,"y":273.75},{"h":120,"id":"operator","label":{"anchor":"center","lines":[{"text":"Operator","tier":0,"weight":"bold"},{"size":12,"text":"[Person]","tier":1},{"size":12,"text":"Runs the line.","tier":2}]},"modelId":"1","name":"Operator","parent":null,"role":"element","shape":"Person","style":{"color":"#ffffff","fill":"#08427b","fontSize":16,"stroke":"#052e56"},"tags":["Element","Person"],"type":"Person","w":240,"x":290.88,"y":12},{"h":120,"id":"plc","label":{"anchor":"center","lines":[{"text":"PLC","tier":0,"weight":"bold"},{"size":12,"text":"[Hardware]","tier":1},{"size":12,"text":"Controls the line.","tier":2}]},"modelId":"7","name":"PLC","parent":null,"role":"element","shape":"Hexagon","style":{"color":"#ffffff","fill":"#1f6f5c","fontSize":16,"stroke":"#154d40"},"tags":["Element","Device"],"type":"Element","w":240,"x":290.88,"y":738.5},{"h":120,"id":"supervisor","label":{"anchor":"center","lines":[{"text":"Supervisor","tier":0,"weight":"bold"},{"size":12,"text":"[Person]","tier":1},{"size":12,"text":"Reviews the shift report.","tier":2}]},"modelId":"2","name":"Supervisor","parent":null,"role":"element","shape":"Person","style":{"color":"#ffffff","fill":"#08427b","fontSize":16,"stroke":"#052e56"},"tags":["Element","Person"],"type":"Person","w":240,"x":25.88,"y":12}],"ports":[],"schema":"buildzr.scene/2","title":"MES containers"}
