{"bounds":[0,0,357.26,884.86],"edges":[{"count":1,"id":"customer->shop","label":{"h":19,"lines":[{"size":12,"text":"Uses","tier":0}],"w":36.59,"x":121.14,"y":172},"points":[[161.73,132],[161.73,231]],"rels":["customer->shop/web-app"],"source":"customer","style":{"arrow":"end","stroke":"#707070","width":1.5},"target":"shop"},{"count":1,"id":"shop->payments","label":{"h":19,"lines":[{"size":12,"text":"Charges cards using","tier":0}],"w":125.13,"x":96.13,"y":693.86},"points":[[225.26,653.86],[225.26,752.86]],"rels":["shop/api->payments"],"source":"shop","style":{"arrow":"end","stroke":"#707070","width":1.5},"target":"payments"}],"key":"landscape","layout":{"engine":"elkjs","inputHash":"sha256:62eec18eff70bf0c1283723779bf6af019eb920727e6ba1684e175ef2b55e910","options":{"elk.algorithm":"layered","elk.direction":"DOWN","elk.edgeRouting":"ORTHOGONAL","elk.hierarchyHandling":"INCLUDE_CHILDREN","elk.layered.considerModelOrder.strategy":"NONE","elk.layered.spacing.edgeEdgeBetweenLayers":"10","elk.layered.spacing.edgeNodeBetweenLayers":"10","elk.layered.spacing.nodeNodeBetweenLayers":"40","elk.padding":"[top=12,left=12,bottom=12,right=12]","elk.spacing.edgeEdge":"10","elk.spacing.edgeLabel":"4","elk.spacing.edgeNode":"10","elk.spacing.nodeNode":"25"},"passes":2,"version":"0.12.0"},"level":{"kind":"landscape","scope":null},"modelHash":"sha256:79288b1fe9504a57cb949fb0708d2417ec651fc79440eeb9162b6a466fe28ade","nodes":[{"h":120,"id":"customer","label":{"anchor":"center","lines":[{"text":"Customer","tier":0,"weight":"bold"},{"size":12,"text":"[Person]","tier":1}]},"modelId":"1","name":"Customer","parent":null,"role":"element","shape":"Person","style":{"color":"#ffffff","fill":"#08427b","fontSize":16,"stroke":"#052e56"},"tags":["Element","Person"],"type":"Person","w":240,"x":41.73,"y":12},{"h":120,"id":"payments","label":{"anchor":"center","lines":[{"text":"Payments","tier":0,"weight":"bold"},{"size":12,"text":"[Software System]","tier":1}]},"modelId":"6","name":"Payments","parent":null,"role":"element","shape":"Box","style":{"color":"#ffffff","fill":"#1168bd","fontSize":16,"stroke":"#0b4884"},"tags":["Element","Software System"],"type":"SoftwareSystem","w":240,"x":105.26,"y":752.86},{"frame":{"childType":"Container","children":3,"scale":0.705941,"scene":"e/shop"},"h":422.86,"id":"shop","label":{"anchor":"top","lines":[{"text":"Shop","tier":0,"weight":"bold"},{"size":12,"text":"[Software System]","tier":1}]},"modelId":"2","name":"Shop","parent":null,"role":"element","shape":"Box","style":{"color":"#ffffff","fill":"#1168bd","fontSize":16,"stroke":"#0b4884"},"tags":["Element","Software System","Internal"],"type":"SoftwareSystem","w":317.84,"x":12,"y":231}],"ports":[],"schema":"buildzr.scene/2","title":"Dynamic steps"}
