{"bounds":[0,0,853.46,1181],"edges":[{"count":1,"id":"customer->online-shop/web-app#1","label":{"h":19,"lines":[{"size":12,"text":"1: Submits the basket in","tier":0}],"w":141.6,"x":35.86,"y":172},"order":"1","points":[[181.46,132],[181.46,289]],"rels":["customer->online-shop/web-app"],"source":"customer","style":{"arrow":"end","stroke":"#555555","width":2},"target":"online-shop/web-app"},{"count":1,"id":"online-shop/api-gateway->online-shop/order-service/order-api#3","label":{"h":19,"lines":[{"size":12,"text":"3: Routes the order to","tier":0}],"w":131.35,"x":48.11,"y":661},"order":"3","points":[[181.46,588],[181.46,700]],"rels":["online-shop/api-gateway->online-shop/order-service/order-api"],"source":"online-shop/api-gateway","style":{"arrow":"end","stroke":"#555555","width":2},"target":"online-shop/order-service/order-api"},{"count":1,"id":"online-shop/order-service/checkout->online-shop/order-service/order-repository#6","label":{"h":19,"lines":[{"size":12,"text":"6: Saves the order with","tier":0}],"w":139.25,"x":300.21,"y":661},"order":"6","points":[[441.46,636],[441.46,700]],"rels":["online-shop/order-service/checkout->online-shop/order-service/order-repository"],"source":"online-shop/order-service/checkout","style":{"arrow":"end","stroke":"#555555","width":2},"target":"online-shop/order-service/order-repository"},{"count":1,"id":"online-shop/order-service/checkout->online-shop/order-service/payment-client#4","label":{"h":19,"lines":[{"size":12,"text":"4: Charges through","tier":0}],"w":118.05,"x":581.41,"y":661},"order":"4","points":[[521.46,636],[521.46,651],[701.46,651],[701.46,700]],"rels":["online-shop/order-service/checkout->online-shop/order-service/payment-client"],"source":"online-shop/order-service/checkout","style":{"arrow":"end","stroke":"#555555","width":2},"target":"online-shop/order-service/payment-client"},{"count":1,"id":"online-shop/order-service/payment-client->payment-provider#5","label":{"h":19,"lines":[{"size":12,"text":"5: Charges the card with","tier":0}],"w":147.11,"x":550.35,"y":913},"order":"5","points":[[701.46,820],[701.46,1001]],"rels":["online-shop/order-service/payment-client->payment-provider"],"source":"online-shop/order-service/payment-client","style":{"arrow":"end","stroke":"#555555","width":2},"target":"payment-provider"},{"count":1,"id":"online-shop/web-app->online-shop/api-gateway#2","label":{"h":19,"lines":[{"size":12,"text":"2: Sends the order to","tier":0}],"w":127.46,"x":52,"y":429},"order":"2","points":[[181.46,409],[181.46,468]],"rels":["online-shop/web-app->online-shop/api-gateway"],"source":"online-shop/web-app","style":{"arrow":"end","stroke":"#555555","width":2},"target":"online-shop/api-gateway"}],"key":"v/place-order","layout":{"engine":"elkjs","inputHash":"sha256:b87007350d9b0e03d0cd3b9b1bfff7e0be73b090af7691e9e3d60513c98e5912","options":{"elk.algorithm":"layered","elk.direction":"DOWN","elk.edgeRouting":"ORTHOGONAL","elk.hierarchyHandling":"INCLUDE_CHILDREN","elk.layered.considerModelOrder.strategy":"NONE","elk.layered.spacing.edgeEdgeBetweenLayers":"10","elk.layered.spacing.edgeNodeBetweenLayers":"10","elk.layered.spacing.nodeNodeBetweenLayers":"40","elk.padding":"[top=12,left=12,bottom=12,right=12]","elk.spacing.edgeEdge":"10","elk.spacing.edgeLabel":"4","elk.spacing.edgeNode":"10","elk.spacing.nodeNode":"25"},"passes":1,"version":"0.12.0"},"level":{"kind":"view","scope":"place-order"},"modelHash":"sha256:38854a9350212aa1f05a3a91e7d4dd19a19c8f559f2413fedaf4081dddc0805b","nodes":[{"h":120,"id":"customer","label":{"anchor":"center","lines":[{"text":"Customer","tier":0,"weight":"bold"},{"size":12,"text":"[Person]","tier":1},{"size":12,"text":"Browses the catalogue and buys","tier":2},{"size":12,"text":"things.","tier":2}]},"modelId":"1","name":"Customer","parent":null,"role":"element","shape":"Person","style":{"color":"#ffffff","fill":"#08427b","fontSize":16,"stroke":"#052e56"},"tags":["Element","Person"],"type":"Person","w":240,"x":61.46,"y":12},{"h":192,"id":"group:external","label":{"anchor":"bottom-left","lines":[{"text":"External","tier":0,"weight":"bold"}]},"name":"External","parent":null,"role":"boundary","shape":"Box","style":{"color":"#000000","dash":[6,4],"fill":"#ffffff","fontSize":16,"stroke":"#888888"},"tags":["Element","Group","Group:External"],"type":"Group","w":280,"x":561.46,"y":977},{"h":120,"id":"payment-provider","label":{"anchor":"center","lines":[{"text":"Payment Provider","tier":0,"weight":"bold"},{"size":12,"text":"[Software System]","tier":1},{"size":12,"text":"Takes card payments.","tier":2}]},"modelId":"17","name":"Payment Provider","parent":"group:external","role":"element","shape":"Box","style":{"color":"#ffffff","fill":"#8a8a8a","fontSize":16,"stroke":"#606060"},"tags":["Element","Software System","External"],"type":"SoftwareSystem","w":240,"x":581.46,"y":1001},{"h":632,"id":"group:shop","label":{"anchor":"bottom-left","lines":[{"text":"Shop","tier":0,"weight":"bold"}]},"name":"Shop","parent":null,"role":"boundary","shape":"Box","style":{"color":"#000000","dash":[6,4],"fill":"#ffffff","fontSize":16,"stroke":"#888888"},"tags":["Element","Group","Group:Shop"],"type":"Group","w":829.46,"x":12,"y":236},{"h":371,"id":"online-shop","label":{"anchor":"bottom-left","lines":[{"text":"Online Shop","tier":0,"weight":"bold"},{"size":12,"text":"[Software System]","tier":1}]},"modelId":"3","name":"Online Shop","parent":"group:shop","role":"boundary","shape":"Box","style":{"color":"#1168bd","dash":[6,4],"fill":"#ffffff","fontSize":16,"stroke":"#1168bd"},"tags":["Element","Software System"],"type":"SoftwareSystem","w":289.46,"x":32,"y":265},{"h":120,"id":"online-shop/api-gateway","label":{"anchor":"center","lines":[{"text":"API Gateway","tier":0,"weight":"bold"},{"size":12,"text":"[Container: Kong]","tier":1},{"size":12,"text":"One entry point for the apps.","tier":2}]},"modelId":"5","name":"API Gateway","parent":"online-shop","role":"element","shape":"Box","style":{"color":"#000000","fill":"#438dd5","fontSize":16,"stroke":"#2e6295"},"tags":["Element","Container"],"type":"Container","w":240,"x":61.46,"y":468},{"h":120,"id":"online-shop/web-app","label":{"anchor":"center","lines":[{"text":"Web App","tier":0,"weight":"bold"},{"size":12,"text":"[Container: TypeScript, React]","tier":1},{"size":12,"text":"The storefront in the browser.","tier":2}]},"modelId":"4","name":"Web App","parent":"online-shop","role":"element","shape":"WebBrowser","style":{"color":"#000000","fill":"#438dd5","fontSize":16,"stroke":"#2e6295"},"tags":["Element","Container","Browser"],"type":"Container","w":240,"x":61.46,"y":289},{"h":120,"id":"online-shop/order-service/checkout","label":{"anchor":"center","lines":[{"text":"Checkout","tier":0,"weight":"bold"},{"size":12,"text":"[Component: Python]","tier":1},{"size":12,"text":"Prices the basket and starts the","tier":2},{"size":12,"text":"payment.","tier":2}]},"modelId":"8","name":"Checkout","parent":"group:shop","role":"element","shape":"Box","style":{"color":"#000000","fill":"#85bbf0","fontSize":16,"stroke":"#5d82a8"},"tags":["Element","Component"],"type":"Component","w":240,"x":361.46,"y":516},{"h":120,"id":"online-shop/order-service/order-api","label":{"anchor":"center","lines":[{"text":"Order API","tier":0,"weight":"bold"},{"size":12,"text":"[Component: FastAPI]","tier":1},{"size":12,"text":"REST endpoints for orders.","tier":2}]},"modelId":"7","name":"Order API","parent":"group:shop","role":"element","shape":"Box","style":{"color":"#000000","fill":"#85bbf0","fontSize":16,"stroke":"#5d82a8"},"tags":["Element","Component"],"type":"Component","w":240,"x":61.46,"y":700},{"h":120,"id":"online-shop/order-service/order-repository","label":{"anchor":"center","lines":[{"text":"Order Repository","tier":0,"weight":"bold"},{"size":12,"text":"[Component: SQLAlchemy]","tier":1},{"size":12,"text":"Reads and writes orders.","tier":2}]},"modelId":"9","name":"Order Repository","parent":"group:shop","role":"element","shape":"Box","style":{"color":"#000000","fill":"#85bbf0","fontSize":16,"stroke":"#5d82a8"},"tags":["Element","Component"],"type":"Component","w":240,"x":321.46,"y":700},{"h":120,"id":"online-shop/order-service/payment-client","label":{"anchor":"center","lines":[{"text":"Payment Client","tier":0,"weight":"bold"},{"size":12,"text":"[Component: httpx]","tier":1},{"size":12,"text":"Calls the payment provider.","tier":2}]},"modelId":"10","name":"Payment Client","parent":"group:shop","role":"element","shape":"Box","style":{"color":"#000000","fill":"#85bbf0","fontSize":16,"stroke":"#5d82a8"},"tags":["Element","Component"],"type":"Component","w":240,"x":581.46,"y":700}],"ports":[],"schema":"buildzr.scene/2","title":"Place an order"}
