{"bounds":[0,0,529,363],"edges":[{"count":1,"id":"plc->conveyor","label":{"h":19,"lines":[{"size":12,"text":"Drives","tier":0}],"w":44.16,"x":83.84,"y":172},"points":[[132,132],[132,231]],"rels":["plc->conveyor"],"source":"plc","style":{"arrow":"end","stroke":"#707070","width":1.5},"target":"conveyor"},{"count":1,"id":"plc->sensor","label":{"h":19,"lines":[{"size":12,"text":"Reads","tier":0}],"w":43.14,"x":402,"y":172},"points":[[212,132],[212,142],[397,142],[397,231]],"rels":["plc->sensor"],"source":"plc","style":{"arrow":"end","stroke":"#707070","width":1.5},"target":"sensor"}],"key":"v/devices","layout":{"engine":"elkjs","inputHash":"sha256:8b5883d467f0d878f286278ba2e0487a51ad88e5bab5156760fd7f1edd89b119","options":{"elk.algorithm":"layered","elk.direction":"DOWN","elk.edgeRouting":"ORTHOGONAL","elk.hierarchyHandling":"INCLUDE_CHILDREN","elk.layered.considerModelOrder.strategy":"NONE","elk.layered.spacing.edgeEdgeBetweenLayers":"10","elk.layered.spacing.edgeNodeBetweenLayers":"10","elk.layered.spacing.nodeNodeBetweenLayers":"40","elk.padding":"[top=12,left=12,bottom=12,right=12]","elk.spacing.edgeEdge":"10","elk.spacing.edgeLabel":"4","elk.spacing.edgeNode":"10","elk.spacing.nodeNode":"25"},"passes":1,"version":"0.12.0"},"level":{"kind":"view","scope":"devices"},"modelHash":"sha256:8d1715251b439bf7d5b8d1a8b6b8235de99feaaa9f0a43a3d6a50e26b10d7d56","nodes":[{"h":120,"id":"conveyor","label":{"anchor":"center","lines":[{"text":"Conveyor","tier":0,"weight":"bold"},{"size":12,"text":"Moves the parts.","tier":2}]},"modelId":"9","name":"Conveyor","parent":null,"role":"element","shape":"Box","style":{"color":"#000000","fill":"#dddddd","fontSize":16,"stroke":"#9a9a9a"},"tags":["Element"],"type":"Element","w":240,"x":12,"y":231},{"h":120,"id":"plc","label":{"anchor":"center","lines":[{"text":"PLC","tier":0,"weight":"bold"},{"size":12,"text":"[Hardware]","tier":1},{"size":12,"text":"Controls the line.","tier":2}]},"modelId":"7","name":"PLC","parent":null,"role":"element","shape":"Hexagon","style":{"color":"#ffffff","fill":"#1f6f5c","fontSize":16,"stroke":"#154d40"},"tags":["Element","Device"],"type":"Element","w":240,"x":52,"y":12},{"h":120,"id":"sensor","label":{"anchor":"center","lines":[{"text":"Sensor","tier":0,"weight":"bold"},{"size":12,"text":"[Hardware]","tier":1},{"size":12,"text":"Measures the belt speed.","tier":2}]},"modelId":"8","name":"Sensor","parent":null,"role":"element","shape":"Hexagon","style":{"color":"#ffffff","fill":"#1f6f5c","fontSize":16,"stroke":"#154d40"},"tags":["Element","Device"],"type":"Element","w":240,"x":277,"y":231}],"ports":[],"schema":"buildzr.scene/2","title":"Devices"}
