{"bounds":[0,0,880,340],"edges":[{"count":1,"id":"billing/api/invoicer->billing/api/payments","points":[[280,170],[320,170]],"rels":["billing/api/invoicer->billing/api/payments"],"source":"billing/api/invoicer","style":{"arrow":"end","stroke":"#707070","width":1.5},"target":"billing/api/payments"},{"count":1,"id":"billing/api/invoicer->port:billing/api->port:billing->crm","points":[[100,240],[100,340]],"rels":["billing/api/invoicer->crm"],"source":"billing/api/invoicer","style":{"arrow":"end","stroke":"#707070","width":1.5},"target":{"port":"billing/api->port:billing->crm"}},{"count":1,"id":"billing/api/invoicer->port:billing/api->port:billing->email","points":[[40,200],[0,200]],"rels":["billing/api/invoicer->email"],"source":"billing/api/invoicer","style":{"arrow":"end","stroke":"#707070","width":1.5},"target":{"port":"billing/api->port:billing->email"}},{"count":1,"id":"billing/api/ledger-repo->port:billing/api->billing/db","points":[[720,240],[720,300],[440,300],[440,340]],"rels":["billing/api/ledger-repo->billing/db"],"source":"billing/api/ledger-repo","style":{"arrow":"end","stroke":"#707070","width":1.5},"target":{"port":"billing/api->billing/db"}},{"count":1,"id":"billing/api/payments->port:billing/api->billing/db","points":[[440,240],[440,340]],"rels":["billing/api/payments->billing/db"],"source":"billing/api/payments","style":{"arrow":"end","stroke":"#707070","width":1.5},"target":{"port":"billing/api->billing/db"}},{"count":1,"id":"port:billing/web->billing/api->billing/api/payments","points":[[440,0],[440,100]],"rels":["billing/web->billing/api/payments"],"source":{"port":"billing/web->billing/api"},"style":{"arrow":"end","stroke":"#707070","width":1.5},"target":"billing/api/payments"}],"key":"e/billing/api","layout":{"engine":"hand","inputHash":"sha256:unknown","passes":1,"version":"1"},"level":{"kind":"element","scope":"billing/api"},"modelHash":"sha256:06be66564654b8ff9d1a808a6dec5331d1553974daad9d56c9e018c5b454d7dc","nodes":[{"h":140,"id":"billing/api/invoicer","label":{"anchor":"center","lines":[{"text":"Invoicer","tier":0,"weight":"bold"},{"size":12,"text":"[Component: Go]","tier":1}]},"modelId":"6","name":"Invoicer","parent":null,"role":"element","shape":"Box","style":{"color":"#000000","fill":"#85bbf0","fontSize":16,"stroke":"#5d82a8"},"tags":["Element","Component"],"type":"Component","w":240,"x":40,"y":100},{"h":140,"id":"billing/api/ledger-repo","label":{"anchor":"center","lines":[{"text":"Ledger Repo","tier":0,"weight":"bold"},{"size":12,"text":"[Component: Go, sqlc]","tier":1}]},"modelId":"8","name":"Ledger Repo","parent":null,"role":"element","shape":"Box","style":{"color":"#000000","fill":"#85bbf0","fontSize":16,"stroke":"#5d82a8"},"tags":["Element","Component"],"type":"Component","w":240,"x":600,"y":100},{"h":140,"id":"billing/api/payments","label":{"anchor":"center","lines":[{"text":"Payments","tier":0,"weight":"bold"},{"size":12,"text":"[Component: Go]","tier":1}]},"modelId":"7","name":"Payments","parent":null,"role":"element","shape":"Box","style":{"color":"#000000","fill":"#85bbf0","fontSize":16,"stroke":"#5d82a8"},"tags":["Element","Component","PCI"],"type":"Component","w":240,"x":320,"y":100}],"ports":[{"id":"billing/api->billing/db","side":"S","x":440,"y":340},{"id":"billing/api->port:billing->crm","side":"S","x":100,"y":340},{"id":"billing/api->port:billing->email","side":"W","x":0,"y":200},{"id":"billing/web->billing/api","side":"N","x":440,"y":0},{"id":"port:crm->billing->billing/api","side":"N","x":760,"y":0}],"schema":"buildzr.scene/2","title":"Billing API"}
